<!ELEMENT keyboard (layout | import)*>
<!ELEMENT import EMPTY>
<!ELEMENT layout (section+)>
<!ELEMENT section (row+)>
<!ELEMENT row (key | spacer)*>
<!ELEMENT key (binding+)>
<!ELEMENT spacer EMPTY>
<!ELEMENT binding EMPTY>

<!ATTLIST keyboard
  version CDATA "1.0"
  title CDATA #IMPLIED
  language CDATA #IMPLIED
  catalog CDATA #IMPLIED
  autocapitalization (true | false) "true">

<!ATTLIST import
  file CDATA #REQUIRED>

<!ATTLIST layout
  type (general | url | email | number | phonenumber | common) "general"
  orientation (landscape | portrait) "landscape">

<!ATTLIST section
  id CDATA #REQUIRED
  movable (true | false) "true"
  type (sloppy | non-sloppy) "sloppy">

<!ATTLIST row
  height (small | medium | large | x-large | xx-large) "medium"
  fixed (true | false) "false">

<!ATTLIST key
  style (normal | special | deadkey) "normal"
  width (small | medium | large | x-large | xx-large | stretched) "medium"
  fixed (true | false) "false"
  rtl (true | false) "false"
  id CDATA #IMPLIED
>

<!ATTLIST binding
  action (insert | shift | backspace | space | cycle | layout_menu | sym
          | return | commit | decimal_separator | plus_minus_toggle | switch) "insert"
  shift (true|false) "false"
  alt (true|false) "false"
  label CDATA #IMPLIED
  secondary_label CDATA #IMPLIED
  accents CDATA #IMPLIED
  accented_labels CDATA #IMPLIED
  extended_labels CDATA #IMPLIED
  cycleset CDATA #IMPLIED
  dead (true | false) "false"
  quickpick (true | false) "false">
