<?xml version="1.0" encoding="utf-8"?>
<!DOCTYPE keyboard SYSTEM 'VirtualKeyboardLayout.dtd'>
<keyboard title="test-import2-title" version="1.0" catalog="en_GB" language="test-import2-language" >
  <layout type="general" orientation="portrait" >
    <section id="main" type="sloppy" movable="false">
      <row>
        <key>
          <binding label="2" />
        </key>
      </row>
      <row>
        <key>
          <binding label="func2" />
        </key>
      </row>
    </section>
  </layout>
</keyboard>
