<?xml version="1.0" encoding="utf-8"?>
<!DOCTYPE keyboard SYSTEM 'VirtualKeyboardLayout.dtd'>
<keyboard version="1.0" catalog="symbols">
    <layout type="general" orientation="landscape">
        <section id="symbols0" type="non-sloppy" movable="false">
          <row>
            <key>
              <binding label="&#x0026;"/>
            </key>
            <key>
              <binding label="¿"/>
            </key>
            <key>
              <binding label="¡"/>
            </key>
            <key>
              <binding label="="/>
            </key>
            <key>
              <binding label="&#x005C;"/>
            </key>
            <key>
              <binding label="_"/>
            </key>
            <key>
              <binding label="~"/>
            </key>
            <key>
              <binding label="|"/>
            </key>
            <key>
              <binding label="^"/>
            </key>
            <key>
              <binding label="`"/>
            </key>
          </row>

          <row>
            <key>
              <binding label="€"/>
            </key>
            <key>
              <binding label="£"/>
            </key>
            <key>
              <binding label="$"/>
            </key>
            <key>
              <binding label="¥"/>
            </key>
            <key>
              <binding label="&#x2018;"/>
            </key>
            <key>
              <binding label="&#x0022;"/>
            </key>
            <key>
              <binding label="&#x201C;"/>
            </key>
            <key>
              <binding label="&#x201D;"/>
            </key>
            <key>
              <binding label="&#x201E;"/>
            </key>
            <key>
              <binding label="&#x201F;"/>
            </key>
          </row>

          <row>
            <key>
              <binding label="%"/>
            </key>
            <key>
              <binding label="&#x2030;"/>
            </key>
            <key>
              <binding label="&#x003C;"/>
            </key>
            <key>
              <binding label="&#x003E;"/>
            </key>
            <key>
              <binding label="«"/>
            </key>
            <key>
              <binding label="»"/>
            </key>
            <key>
              <binding label="["/>
            </key>
            <key>
              <binding label="]"/>
            </key>
            <key>
              <binding label="{"/>
            </key>
            <key>
              <binding label="}"/>
            </key>
          </row>
        </section>
    </layout>
</keyboard>
