<?xml version="1.0" encoding="utf-8"?>
<!DOCTYPE keyboard SYSTEM 'VirtualKeyboardLayout.dtd'>
<keyboard title="Español" version="1.0" catalog="es" language="es">
    <layout type="general" orientation="landscape">
        <section id="main" movable="false">
          <row>
            <key>
              <binding label="q"/>
              <binding shift="true" label="Q"/>
            </key>
            <key>
              <binding label="w"/>
              <binding shift="true" label="W"/>
            </key>
            <key>
              <binding accented_labels="éë" accents="´¨" label="e"
                       extended_labels="êè"/>
              <binding shift="true" accented_labels="ÉË" accents="´¨" label="E"
                       extended_labels="ÊÈ"/>
            </key>
            <key>
              <binding label="r"/>
              <binding shift="true" label="R"/>
            </key>
            <key>
              <binding label="t"/>
              <binding shift="true" label="T"/>
            </key>
            <key>
              <binding accented_labels="ýÿ" accents="´¨" label="y"/>
              <binding shift="true" accented_labels="ÝŸ" accents="´¨" label="Y"/>
            </key>
            <key>
              <binding accented_labels="úü" accents="´¨" label="u"/>
              <binding shift="true" accented_labels="ÚÜ" accents="´¨" label="U"/>
            </key>
            <key>
              <binding accented_labels="íï" accents="´¨" label="i"/>
              <binding shift="true" accented_labels="ÍÏ" accents="´¨" label="I"/>
            </key>
            <key>
              <binding accented_labels="óö" accents="´¨" label="o"/>
              <binding shift="true" accented_labels="ÓÖ" accents="´¨" label="O"/>
            </key>
            <key id="actionKey">
              <binding label="p"/>
              <binding shift="true" label="P"/>
            </key>
          </row>
          <row>
            <key>
              <binding accented_labels="áä" accents="´¨" label="a"/>
              <binding shift="true" accented_labels="ÁÄ" accents="´¨" label="A"/>
            </key>
            <key>
              <binding label="s"/>
              <binding shift="true" label="S"/>
            </key>
            <key>
              <binding label="d"/>
              <binding shift="true" label="D"/>
            </key>
            <key>
              <binding label="f"/>
              <binding shift="true" label="F"/>
            </key>
            <key>
              <binding label="g"/>
              <binding shift="true" label="G"/>
            </key>
            <key>
              <binding label="h"/>
              <binding shift="true" label="H"/>
            </key>
            <key>
              <binding label="j"/>
              <binding shift="true" label="J"/>
            </key>
            <key>
              <binding label="k"/>
              <binding shift="true" label="K"/>
            </key>
            <key>
              <binding label="l"/>
              <binding shift="true" label="L"/>
            </key>
            <key>
              <binding label="ñ"/>
              <binding shift="true" label="Ñ"/>
            </key>
          </row>
          <row>
            <key>
              <binding label="z"/>
              <binding shift="true" label="Z"/>
            </key>
            <key>
              <binding label="x"/>
              <binding shift="true" label="X"/>
            </key>
            <key>
              <binding label="c"/>
              <binding shift="true" label="C"/>
            </key>
            <key>
              <binding label="v"/>
              <binding shift="true" label="V"/>
            </key>
            <key>
              <binding label="b"/>
              <binding shift="true" label="B"/>
            </key>
            <key>
              <binding label="n"/>
              <binding shift="true" label="N"/>
            </key>
            <key>
              <binding label="m"/>
              <binding shift="true" label="M"/>
            </key>
            <key>
              <binding label="ç"/>
              <binding shift="true" label="Ç"/>
            </key>
            <key>
              <binding dead="true" label="´"/>
              <binding shift="true" dead="true" label="¨"/>
            </key>
            <key>
              <binding action="backspace" label=""/>
            </key>
          </row>
          <row>
            <key>
              <binding action="shift" label=""/>
            </key>
            <key>
              <binding action="sym" label="Sym" secondary_label="áçè"/>
              <binding shift="true" action="layout_menu" label=""/>
            </key>
            <key>
              <binding label="!"/>
              <binding shift="true" label="¡"/>
            </key>
            <key>
              <binding action="space" label=""/>
            </key>
            <key>
              <binding label="?"/>
              <binding shift="true" label="¿"/>
            </key>
            <key>
              <binding label="."/>
              <binding shift="true" label=","/>
            </key>
            <key id="actionKey">
              <binding action="return" label=""/>
            </key>
          </row>
        </section>
    </layout>
</keyboard>
