<?xml version="1.0" encoding="utf-8"?>
<!DOCTYPE keyboard SYSTEM 'VirtualKeyboardLayout.dtd'>
<keyboard version="1.0" title="Phone Number" language="phonenumber" catalog="phonenumber">
  <layout type="phonenumber" orientation="landscape">
    <section id="main" movable="false">
      <row height="x-large">
        <key>
          <binding label="&#x0661;"/>
        </key>
        <key>
          <binding label="&#x0662;" secondary_label="&#x0628;&#x062A;&#x0629;&#x062B;"/>
        </key>
        <key>
          <binding label="&#x0663;" secondary_label="&#x0627;&#x0621;"/>
        </key>
        <key>
          <binding label="&#x0664;" secondary_label="&#x0633;&#x0634;&#x0635;&#x0636;"/>
        </key>
        <key>
          <binding label="&#x0665;" secondary_label="&#x062F;&#x0630;&#x0631;&#x0632;"/>
        </key>
        <key>
          <binding label="&#x0666;" secondary_label="&#x062C;&#x062D;&#x062E;"/>
        </key>
        <key>
          <binding label="&#x0667;" secondary_label="&#x0646;&#x0647;&#x0648;&#x064A;"/>
        </key>
        <key>
          <binding label="&#x0668;" secondary_label="&#x0641;&#x0642;&#x0643;&#x0644;&#x0645;"/>
        </key>
        <key>
          <binding label="&#x0669;" secondary_label="&#x0637;&#x0638;&#x0639;&#x063A;"/>
        </key>
        <key>
          <binding label="&#x0660;"/>
        </key>
      </row>

      <row>
        <spacer/>

        <key>
          <binding label="&#x002A;&#x002B;" cycleset="&#x002A;&#x002B;p" action="cycle"/>
        </key>
        <key>
          <binding label="&#x0023;"/>
        </key>
        <key style="special" width="x-large">
          <binding label="" action="backspace"/>
        </key>
      </row>
    </section>
  </layout>

  <layout type="phonenumber" orientation="portrait">
    <section id="main" movable="false">
      <row>
        <key>
          <binding label="&#x0661;"/>
        </key>
        <key>
          <binding label="&#x0662;" secondary_label="&#x0628;&#x062A;&#x0629;&#x062B;"/>
        </key>
        <key>
          <binding label="&#x0663;" secondary_label="&#x0627;&#x0621;"/>
        </key>
      </row>

      <row> 
        <key>
          <binding label="&#x0664;" secondary_label="&#x0633;&#x0634;&#x0635;&#x0636;"/>
        </key>
        <key>
          <binding label="&#x0665;" secondary_label="&#x062F;&#x0630;&#x0631;&#x0632;"/>
        </key>
        <key>
          <binding label="&#x0666;" secondary_label="&#x062C;&#x062D;&#x062E;"/>
        </key>
      </row>

      <row> 
        <key>
          <binding label="&#x0667;" secondary_label="&#x0646;&#x0647;&#x0648;&#x064A;"/>
        </key>
        <key>
          <binding label="&#x0668;" secondary_label="&#x0641;&#x0642;&#x0643;&#x0644;&#x0645;"/>
        </key>
        <key>
          <binding label="&#x0669;" secondary_label="&#x0637;&#x0638;&#x0639;&#x063A;"/>
        </key>
      </row>

      <row> 
        <key>
          <binding label="&#x002A;&#x002B;" cycleset="&#x002A;&#x002B;p" action="cycle"/>
        </key>
        <key>
          <binding label="&#x0660;"/>
        </key>
        <key>
          <binding label="&#x0023;"/>
        </key>
      </row>

      <row> 
        <spacer/>

        <key style="special" width="x-large">
          <binding label="" action="backspace"/>
        </key>
      </row>
    </section>
  </layout>
</keyboard>

