<?xml version="1.0" encoding="utf-8"?>
<!DOCTYPE keyboard SYSTEM 'VirtualKeyboardLayout.dtd'>
<keyboard version="1.0" catalog="symbols">
  <layout type="general" orientation="landscape">
    <section id="symbols0" type="non-sloppy">
      <row>
        <spacer/>
        <key>
          <binding label="@" quickpick="true"/>
        </key>
        <key>
          <binding label="~"/>
        </key>
        <key>
          <binding label="&#x0027;" quickpick="true"/>
        </key>
        <key>
          <binding label="&#x003B;"/>
        </key>
        <key>
          <binding label="&#x003A;"/>
        </key>
        <spacer/>
      </row>
    </section>

    <section id="symbols1" type="non-sloppy">
      <row>
        <key>
          <binding label="u"/>
        </key>
        <key>
          <binding label="p"/>
        </key>
        <key>
          <binding label="p"/>
        </key>
        <key>
          <binding label="e"/>
        </key>
        <key>
          <binding label="r"/>
        </key>
      </row>
      <row>
        <spacer/>
        <key>
          <binding label="&#x003C;"/>
        </key>
        <key>
          <binding label="&#x003E;"/>
        </key>
        <spacer/>
      </row>
    </section>
  </layout>
</keyboard>
