<?xml version="1.0" encoding="utf-8"?>
<!DOCTYPE keyboard SYSTEM 'VirtualKeyboardLayout.dtd'>
<keyboard version="1.0" title="Number" language="number" catalog="number">
  <layout type="number" orientation="landscape">
    <section id="main" movable="false" horizontal_alignment="center" vertical_alignment="center">
      <row>
        <key>
          <binding label="&#x0661;"/>
        </key>
        <key>
          <binding label="&#x0662;"/>
        </key>
        <key>
          <binding label="&#x0663;"/>
        </key>
        <key>
          <binding label="&#x0664;"/>
        </key>
        <key>
          <binding label="&#x0665;"/>
        </key>
        <key>
          <binding label="&#x0666;"/>
        </key>
        <key>
          <binding label="&#x0667;"/>
        </key>
        <key>
          <binding label="&#x0668;"/>
        </key>
        <key>
          <binding label="&#x0669;"/>
        </key>
        <key>
          <binding label="&#x0660;"/>
        </key>
      </row>
      <row>
        <spacer/>

        <key width="x-large">
          <binding label="&#x002B;&#x002F;&#x002D;" action="plus_minus_toggle"/>
        </key>
        <key width="x-large">
          <binding action="decimal_separator"/>
        </key>
        <key style="special" width="x-large" rtl="true">
          <binding label="" action="backspace"/>
        </key>
      </row>
    </section>
  </layout>

  <layout type="number" orientation="portrait">
    <section id="main" movable="false" horizontal_alignment="center" vertical_alignment="center">
      <row>
        <key>
          <binding label="&#x0661;"/>
        </key>
        <key>
          <binding label="&#x0662;"/>
        </key>
        <key>
          <binding label="&#x0663;"/>
        </key>
      </row>

      <row>
        <key>
          <binding label="&#x0664;"/>
        </key>
        <key>
          <binding label="&#x0665;"/>
        </key>
        <key>
          <binding label="&#x0666;"/>
        </key>
      </row>

      <row>
        <key>
          <binding label="&#x0667;"/>
        </key>
        <key>
          <binding label="&#x0668;"/>
        </key>
        <key>
          <binding label="&#x0669;"/>
        </key>
      </row>

      <row>
        <key>
          <binding label="&#x002B;&#x002F;&#x002D;" action="plus_minus_toggle"/>
        </key>
        <key>
          <binding label="&#x0660;"/>
        </key>
        <key>
          <binding action="decimal_separator"/>
        </key>
      </row>

      <row>
        <spacer/>

        <key style="special" width="x-large" rtl="true">
          <binding label="" action="backspace"/>
        </key>
      </row>
    </section>
  </layout>
</keyboard>
